,title,data,writer,content,section
40,"KT 로봇 사업, 제조 아닌 '서비스' 관점에서 접근하는 이유",2023.07.30. 오전 9:01,김수민 기자,"최지훈 KT 융합기술원 로봇지능프로젝트팀장이 지난 27일 서울시 서초구 우면동에 위치한 KT융합기술원에서 회사의 로봇 플랫폼 R-Brain에 대해 설명하고 있다. (사진=KT)""앞으로 로봇 시장에서 플랫폼이 굉장히 중요할 것으로 봅니다. 우리는 적은 인력으로도 수만대의 로봇을 케어할 수 있는 역할을 하겠습니다""최지훈 KT 융합기술원 로봇지능프로젝트팀장과 권명은 책임연구원은 지난 27일 서울시 서초구 우면동에 위치한 KT융합기술원에서 <블로터>와 만나 R-Brain 중심의 서비스 로봇 시장 확대 계획에 대해 설명하며 이같이 말했다.R-Brain은 수천대의 로봇에서 초단위로 수집한 데이터를 분석해 설치부터 운영까지 최적화 작업을 수행하는 KT의 로봇 데이터 분석 시스템이다. KT는 현재 방역로봇, 서빙로봇 등 시중에 수천대의 로봇을 서비스하고 있는데, 여기에 지난 2022년 10월부터 R-Brain을 접목해 운영 최적화에 나서고 있다.지금까지 로봇 플랫폼이란 개념은 로봇 제조사가 자체적으로 데이터를 수집해 운영을 최적화는 방식이었다. 상용 로봇 전체를 아우르는 플랫폼, 즉 다양한 공급처에 공통적으로 적용할 수 있는 로봇 관제 시스템은 R-Brain이 처음이다.KT는 로봇 디바이스 판매가 아닌, 서비스를 제공하는 사업자로 초점을 맞췄다. 최 팀장은 ""대기업의 경우 로봇 제작, 관제, 마케팅까지 모두 할 수 있는 여력이 있겠지만 로봇 자체에 집중하는 중견·중소업체는 여건이 어렵다""며 ""로봇 본연의 개발에 집중할 수 있도록 하고 우리의 플랫폼을 통해 서비스를 연결시켜 마케팅까지 확대할 수 있는 그런 플랫폼을 만들고 있다""고 설명했다.R-Brain은 수천대의 로봇에서 초 단위로 하루 6000만건의 데이터를 분석한다. 로봇은 확률적으로 완벽하게 움직일 수 없다. 그보다는 운영 상의 오류 확률을 줄이는 것이 중요하다. R-Brain은 수집된 로봇들의 데이터를 학습·분석해 로봇의 설치부터 운영, 오작동 관리 등 최적화 작업을 수행한다. 최 팀장은 ""로봇은 전자적인 부품 등 기기적 문제도 있지만 현장에서 발생하는 사소한 오류도 많다""며 ""R-Brain을 활용해 이를 최대한 빠르게 인지하고 해결할 수 있다""며 ""최소한의 운영 인력만으로 수천대, 수만대의 고객을 케어할 수 있는 플랫폼을 만들고자 한다""고 말했다.KT가 실제로 R-Brain 플랫폼을 도입한 후 올해 상반기 로봇 품질 데이터를 분석한 결과 품질 관련한 고객 문의가 기존보다 65% 가량 감소한 것으로 나타났다. 또, KT가 원격으로 고객의 로봇 서비스를 지원하는 비율은 33%를 차지했는데, 올해 말에는 50%를 넘을 것으로 예측된다.최 팀장은 ""이전에는 고객이 불만이 쌓인 상태에서 VOC(Voice of Customer)를 제기했다면, R-Brain을 활용하면 고객이 오류를 인지하기 전에 우리가 해결할 수 있다""며 ""아직 기술 개발 단계지만 사업장별 고객 환경 맞춤형으로 로봇을 동작시키는게 우리의 목표""라고 말했다.KT R-Brain이 로봇 데이터를 분석하고 있는 모습. (사진=KT)R-Brain에 적용된 핵심 기술은 크게 △운영 지능 △서비스 지능 △사업 지능 등 3가지다.먼저 운영 지능은 로봇의 설치 및 운영 과정에서 발생할 수 있는 문제를 신속하게 파악해 해결책을 제시하는 기술이다. 지도와 로봇의 주행경로, 센싱 정보 등을 화상 처리와 머신러닝 알고리즘을 이용해 분석한 후 로봇의 장애 상황을 예측한다. 주로 모바일 로봇을 대상으로 자율주행용 지도 설치 과정에서의 오류, 금지구역 침범, 자율주행 오작동 등의 문제를 해결한다. 이 기술을 활용하면 로봇 제조사에 관계없이 모든 로봇에 동일한 서비스를 제공할 수 있다.서비스 지능은 고객의 환경과 요구에 맞게 로봇 기능을 최적화하는 기술이다. 로봇이 고객의 상황을 인지해 그에 맞는 맞춤형 서비스를 제공할 수 있는 점이 특징이다. 예를 들어 AI 자동방역 로봇을 R-Brain 내 공기질 솔루션과 연동하면 로봇이 방역을 수행하는 주기와 구역 등을 판단해 방역을 자동으로 진행한다.사업 지능은 로봇의 도입부터 운영까지 전 과정을 관리하는 기술이다. 이 기술로 로봇의 작업 기록을 분석한 후 고객에게 로봇의 활용도를 높일 수 있는 방법을 제시한다. 고객은 로봇 서비스의 효용성을 확인해 최적화된 활용 방법을 파악할 수 있고, KT는 로봇 서비스를 개선해 고객의 요구에 정확히 대응할 수 있다.최 팀장은 ""향후 로봇과 AI가 결합되면서 로봇 기술이 한단계 진화할 것으로 전망된다""며 ""우리는 로봇 제조사와 AI 서비스를 연결하는 플랫폼 역할을 수행하며 로봇 기술의 진화를 좀더 빠르게 앞당길 계획""이라고 말했다.",IT/과학
41,갤Z5 작년보다 1.5배 더 판다…노태문의 승부수,2023.07.30. 오전 10:01,박준호 기자,"갤럭시 언팩 2023에서 환영사하는 노태문 삼성전자 MX사업부장 사장. 이동근기자 foto@etnews.com삼성전자가 갤럭시Z플립5·폴드5를 앞세워 올해 폴더블폰 판매량을 50%이상 확대하는 것을 목표로 내세웠다. 세계 폴더블 시장 전체 성장률에 준하는 판매 증가세를 이어가며 시장을 주도한다는 목표다.30일 업계에 따르면, 삼성전자는 올해 폴더블폰 판매를 지난해보다 1.5배가량 늘린다는 내부 목표를 세웠다. 지난해 연간 판매량이 1000만대였으니, 올해 1500만대 이상 판매하겠다는 의미다.노태문 삼성전자 MX사업부장 사장은 최근 기자간담회에서 “경제 등 대외 환경이 어렵지만 이번 신제품에 대한 초기 반응을 볼때 글로벌 전체 폴더블 시장 성장률에 준하는 성장이 가능할 것”이라고 말했다.삼성전자는 갤Z5가 글로벌 사전예약에서 기대 이상의 호응을 얻으며, 목표치를 높여 잡았다. 갤럭시Z 시리즈 누적 판매량은 올해 3000만대를 넘을 전망이다. 삼성전자는 2025년 갤럭시Z 시리즈 판매량이 갤럭시S 시리즈를 추월할 것으로 보고 있다.노 사장은 “올해 전세계서 판매되는 갤럭시 플래그십 모델 중 폴더블이 차지하는 비중이 20%에 달할 것”이라며 “국내는 이보다 높은 3대 중 1대가 폴더블폰 판매일 것으로 예상한다”고 말했다.폴더블폰 시장이 예상보다 빠르게 커지고 있다는 점은 긍정적이다. 카운터포인트는 2027년 글로벌 폴더블폰 출하량이 1억대를 돌파할 것으로 예상했다.노태문 삼성전자 사장이 28일 서울 서초구 삼성전자 서초사옥에서 기자간담회를 진행하고 있다.삼성전자는 폴더블 대중화를 위해 글로벌 시장 공략에 집중한다. 아직 세계 스마트폰 시장의 폴더블폰 비중은 한 자릿수다. 글로벌 시장을 잡아야 목표 달성이 가능하다. 삼성전자는 현지 콘텐츠에 맞춰 폴더블을 최적화하고 차별화 가격 정책을 유지한다. 갤Z5 판매가는 소폭 인상된 국내와 달리 달러 기준 가격은 동결했다. 중국과 인도 등 신흥 시장에서도 현지 출고가는 기존 수준을 유지했다. 언팩에는 40여개국 700여명 외신 기자를 초청했다.삼성이 폴더블에 힘을 주는 것은 미래 핵심 고객인 1020대의 아이폰 쏠림 현상을 견제하기 위한 이유도 있다. 이달 한국갤럽 조사에 따르면 국내 18~29세의 아이폰 사용률이 65%로 집계됐다. 이번 언팩에서 갤럭시Z플립5를 전면에 내세운 것도 디자인면에서 1020대를 공략에 적합하다는 판단에 따른 전략으로 풀이된다. 노 사장은 “특정 계층에서 갤럭시 선호도가 평균 대비 떨어지는 부분에 대해 마케팅 측면에서 열심히 분석하고 있다”고 말했다.",IT/과학
42,[뉴스잇(IT)쥬]삼성 첫 韓 언팩 개최…폴더블폰 1000만대 이상 판매 목표,2023.07.30. 오후 2:29,윤지원 기자,"이달 26일 K팝 스타와 함께한 코엑스 '언팩'…5번째 폴더블폰KT 대표 후보자 3인 선정…정부, 우주항공청 청사진 공개[편집자주] 정보통신기술(ICT)은 어떤 산업보다 빠르게 변화합니다. 그 안의 다양한 이해관계가 맞물려 소용돌이 치는 분야이기도 하지요. ICT 기사는 어렵다는 편견이 있지만 '기승전ICT'로 귀결되는 4차 산업혁명 시대에 그 중요성은 날로 커지고 있습니다. 전문적인 '그들만의 뉴스'가 아닌 개개인의 일상 생활과도 밀접한 분야죠. 민영통신사 <뉴스1>은 한주간 국내 ICT 업계를 달군 '핫이슈'를 한눈에 제공합니다. 놓쳐버린 주요 뉴스, [뉴스잇(IT)쥬]와 함께 하실래요?26일 서울 강남구 코엑스에서 열린 '갤럭시 언팩 2023' 행사 내 체험존에서 취재진을 비롯한 참석자들이 Z플립5, Z폴드5, 갤럭시 탭S9 등을 체험하고 있다. 2023.7.26/뉴스1 ⓒ News1 김민지 기자(서울=뉴스1) 윤지원 기자 = 삼성전자(005930)가 지난 26일 국내 첫 갤럭시 언팩(신제품 발표) 행사를 열었다. 갤럭시S23 등 판매 호조로 올 2분기 모바일 사업부문 영업이익 두자릿수 성장세를 기록한 삼성전자는 올해 폴더블폰 1000만대 이상을 판매하겠다는 목표를 내놨다.KT(030200)는 대표 공석으로 비상경영체제에 돌입한 지 약 4개월 만에 차기 대표 후보자로 김영섭 전 LG CNS 사장, 박윤영 전 KT 사장, 차상균 서울대 교수 3인을 선정했다. KT 이사회는 심층 면접을 거쳐 이들 중 한명을 후보자로 최종 낙점한다. 정부가 우주항공청 청사진을 발표했다. 과학기술정보통신부는 인력 최대 300명, 예산 약 7000억원 규모로 운영될 것으로 내다봤다. 다만 국회에서 관련 법안을 논의 중인 만큼 이번 청사진이 확정은 아니다.아이브 장원영이 26일 서울 강남구 코엑스에서 열린 '갤럭시 언팩 2023' 행사에서 갤럭시 Z플립5를 공개에 참석하고 있다. (공동취재) 2023.7.26/뉴스1 ⓒ News1 김민지 기자◇얇아지고 빈틈 줄어든 갤럭시 플립·폴드5…내달 11일 출시 삼성전자가 이달 26일 서울 강남 코엑스에서 국내 첫 언팩을 열고 다섯번째 폴더블폰을 선보였다. 갤럭시Z플립·폴드5는 '플렉스 힌지'가 적용돼 주름과 두께가 줄었고 접었을 때의 빈틈이 최소화됐다.판매가는 전작보다 비싸졌다. 플립5는 256GB가 139만9200원, 512GB가 152만200원이다. 폴드5는 256GB 209만7700원, 512GB가 246만700원이다. 제품은 8월11일에 공식 출시된다. 사전 판매 기간은 8월1일부터 7일까지다. 국내에서 처음 열린 언팩에는 유명 K팝 가수들이 대거 참석했다. 이날 방탄소년단(BTS) 멤버 슈가뿐만 아니라 아이브 장원영, 트와이스 정연, 스트레이키즈 등이 자리했다. 올 2분기 모바일경험(MX)·네트워크(NW) 부문 실적이 전망치를 상회한 가운데 올해 폴더블폰 목표 판매량으로 1000만대를 제시했다. 노태문 삼성전자 MX사업부장(사장)은 지난 28일 서초사옥에서 기자 간담회를 열고 ""국내 갤럭시 플래그십(최상위) 폰 3대 중 1대를 폴더블로 판매할 것""이라며 ""올해 글로벌 폴더블 판매 비중이 전체 갤럭시 플래그심의 20%를 넘어설 것""이라고 말했다.사진은 이달 20일 오후 서울 kt 광화문 빌딩 모습. 2023.7.20/뉴스1 ⓒ News1 박지혜 기자◇KT 차기 대표 후보 차상균·김영섭·박윤영 3파전KT는 지 27일 차기 대표 후보자로 김영섭 전 LG CNS 사장, 박윤영 전 KT 사장, 차상균 서울대학교 교수 등 3명을 선정했다.이달 12일까지 대표 후보를 공개 모집한 결과 사외 후보자 27명, 사내 후보자 약 11명이 지원한 것으로 알려졌다. 이후 이사후보추천위원회가 약 3주간 서류 심사 및 비대면 인터뷰를 진행했다.추천위는 외부 전문가로 구성된 인선자문단의 의견을 종합 고려해 3인을 선정했다고 전했다.김영선 전 사장은 1959년생으로 1984년 LG상사 전신인 럭키금성상사에 입사해 LG CNS 대표까지 맡은 'LG맨'이다. 2014년에는 KT 경쟁사 LG유플러스 최고재무책임자(CFO)를 지냈다. 1962년생인 박윤영 전 사장은 1992년 KT 전신인 한국통신에 입사한 'KT맨'이다. 2019년 KT 대표 자리를 놓고 구현모 전 대표와 경합을 벌였으나, 구 전 대표에 밀렸다. 지난 2월 구 전 대표가 연임을 포기한 후 차기 대표 후보자 4인 중 하나로 뽑혔으나 윤경림 KT 트랜스포메이션부문장이 최종 선정됐다. 1958년생인 차상균 교수는 이석채·황창규 KT 회장 시절인 2012~2019년 KT 사외이사를 지냈다. 이후 서울대 빅데이터연구원장, 서울대 데이터사이언스대학원 초대 원장 등을 역임했다. KT는 다음  첫째주 최종 후보를 확정할 전망이다. 이후 8월 말 주주총회를 거쳐 신임 대표가 공식 선임된다. 주총 의결 기준은 참여주식의 60% 이상 찬성이다.◇300명 이내·7000억원 규모 우주항공청 청사진 발표이달 27일 과기정통부는 '우주항공청 설립·운영 기본계획'을 발표했다. 우주항공청은 우주항공 정책을 세우고 연구개발·기술 확보·인력 양성 등을 주도하는 조직이다. 과기정통부는 300명 이내 인력 규모로 약 7000억 규모의 예산이 투입될 것으로 내다봤다 청장, 차장, 본부장을 두고 △발사체 부문 △우주과학·탐사 부문 △인공위성 부문 △첨단항공 부문 △우주항공정책 부문 △우주항공 비즈니스 부문 △우주항공 국제협력부문 등으로 나뉜다. 우주항공청이 설립되면 국방부, 과기정통부 등 각 부처에서 수행하던 우주항공 업무도 청으로 이관된다. 그러나 이번 안이 확정은 아니다. 현재 국회에서 우주항공청 설립 등 관련 법안을 논의 중이다.",IT/과학
43,스레드 광풍 꺾이고 트위터 간판 ‘X’로… SNS 판이 흔들린다,2023.07.31. 오전 4:10,조민아 기자,"스레드 가입 1억명 이후 이용 급감‘사용자 원하는 기능 부족’ 주요인파랑새 날려버린 ‘X’ 대대적 개편틱톡은 ‘텍스트 게시물 공유’ 도입트위터가 2006년 설립 이후 줄곧 사용한 ‘파랑새’ 로고를 버리고 지난 24일 ‘X’를 새로운 브랜드로 채택했다. 일론 머스크 트위터·테슬라 최고경영자(CEO)는 X를 ‘모든 것의 애플리케이션’으로 만들겠다면서 “트위터라는 이름은 맞지 않는다”고 밝혔다. 오른쪽 사진은 지난 7일 인도의 한 디자인회사 직원이 스레드 앱을 설치하고 있는 모습. 트위터의 대항마라는 평가를 받으면서 눈길을 끈 스레드는 출시한 지 1주일도 안 돼 가입자가 1억명을 넘었다. 하지만 최근 이용자 증가 폭이 둔화하고 있다. AFP·EPA연합뉴스SNS 시장이 지각변동을 일으키고 있다. 트위터 대항마로 주목받았던 ‘스레드’는 출시 한 달도 안 돼 시들한 모습을 보인다. 트위터는 ‘파랑새’ 대신 알파벳 ‘X’로 대표 이미지를 바꾸면서 대대적 개편에 돌입했다. 틱톡은 ‘텍스트 게시물’을 공유하는 기능을 도입하고 나섰다.30일 트래픽 통계 사이트 시밀러웹에 따르면 스레드의 일일 활성 사용자 수(DAU)는 지난 23일(현지시간) 기준으로 1260만명가량에 이르렀다. 지난 7일 최고치(4900만명)와 비교하면 75% 가까이 급락했다. 트위터 DAU의 12% 정도에 불과한 수준이다. 사용자들이 스레드 앱에서 보낸 시간도 출시 직후의 하루 평균 21분에서 최근 1주일간 5분 미만으로 줄었다.데이터분석업체 퀴버퀀터테이티브는 스레드 가입자 수를 지난 28일 기준 1억1900만명으로 추산했다. 지난 10일 정보통신(IT) 플랫폼 가운데 가장 빠른 속도로 1억명에 도달한 뒤로 증가세가 꺾였다. 마크 저커버그 메타 최고경영자(CEO)는 27일 직원들에게 “가입자 1억명 이상이 모두 혹은 그중 절반이라도 앱에 머문다면 이상적일 것이다. 우리는 거기에 아직 도달하지 못했다”고 말했다. 이어 “이용자 감소 현상은 정상적”이라며 “검색이나 데스크톱 버전 등 여러 기능을 추가하면 상황은 나아질 것”이라고 덧붙였다.스레드가 ‘흥행’을 이어가지 못하는 이유로 ‘이용자가 원하는 기능’이 부족하다는 게 꼽힌다. 스레드 메인피드에는 알고리즘에 따라 팔로우하지 않은 인플루언서나 모르는 사람의 게시물이 뜬다. 브랜드 계정 등의 광고성 게시물도 노출돼 이용자 피로도가 높아지고 있다. 검색에선 특정인 계정만 찾을 수 있다. 단어·주제별 키워드 검색 기능은 도입되지 않았다. 트위터처럼 실시간 트렌드를 보여주는 탭이 없다. 다만 자신이 팔로우하는 계정의 게시물을 시간순으로 볼 수 있는 ‘팔로잉 탭’이 새로 도입된다.시밀러웹은 “스레드는 사용자들이 습관적으로 앱을 체크하도록 만들려면, 누락된 기능을 채우는 동시에 새롭고 독특한 기능을 추가해야 한다”고 지적했다. 미국 경제매체 비즈니스 인사이더는 “트위터는 중요한 정보를 지속적으로 제공하는 것으로 인기를 끌었다면, 메타는 스레드가 인플루언서와 라이프스타일 브랜드의 모임 공간이 되기를 원한다”고 분석했다.트위터는 지난 24일부터 ‘X’로 이름과 로고를 바꿨다. 지난해 10월 일론 머스크 테슬라 최고경영자(CEO)에게 인수된 이후 1년도 안 돼 교체를 겪게 된 것이다. 머스크의 우주 항공업체 ‘스페이스 X’와 인공지능(AI) 회사 ‘xAI’에도 X가 들어가 있다. 린다 야카리노 CEO는 직원들에게 보낸 메일에서 “X는 이용자들을 만족시킬 수 있는 비디오, 오디오, 메시징, 은행 및 결제 분야 경험을 계속해서 혁신시킬 것”이라고 강조했다. X의 공식 계정에는 “세계적으로 자격 있는 크리에이터들과 광고 수익을 나누고 있다”는 공지가 올라왔다. 이달부터 X는 콘텐츠 답글이 매월 500만건 이상이면서 유료 계정(트위터 블루)에 가입했고 결제를 위한 ‘스트라이프’ 계정을 가지고 있는 크리에이터들에게 광고 수익을 지급한다.머스크는 자신의 트위터에 “말할 자유를 보장하기 위해 그리고 모든 것의 앱(the everything app) ‘X’의 가속화를 위해 인수한 것”이라고 설명했다. 그는 “몇 달 안에 종합적인 커뮤니케이션과 금융계 전반을 관리할 수 있는 기능을 추가할 것이다. 트위터라는 이름은 그런 측면에서 맞지 않는다”고 했다. 머스크는 최근 트위터의 월간 사용자가 5억4000만명을 넘은 그래프를 올리면서 “올해 새로운 기록에 도달했다”고 자랑하기도 했다.또한 중국 동영상 플랫폼 틱톡은 텍스트 게시물을 공유하는 기능을 출시했다. 글자 수 제한은 1000자 정도이고, 게시물에 음악이나 스티커 장식을 추가할 수 있다. 기존 인스타그램 스토리와 비슷하다. 틱톡은 짧고 단편적인 동영상으로 이용자들을 끌어모았고, 월간 활성 사용자는 14억명에 달한다. IT전문매체 더 버지는 “스레드 등이 트위터를 대체하려고 시도하는 시점에 나온 기능이라 주목할 만하다”며 “로고를 버린 트위터 자리에 다른 앱이 뛰어들 수 있는 창이 열려 있고, 틱톡도 관심이 있는 것으로 보인다”고 했다.",IT/과학
44,"'디지털 기술' 수출 확대, 네이버가 이끈다",2023.07.30. 오전 8:02,이승진 기자,"김유원 네이버클라우드 대표가 '하이퍼클로바X'를 소개하고 있다.정부가 디지털 기술 수출 저변 확대에 나서며 네이버에 대한 관심이 높아지고 있다. 네이버는 클라우드, 인공지능(AI) 등 다양한 기술 경쟁력을 갖추고 있어 디지털 기술 수출에 앞장설 것으로 기대된다.지난 6월 과학기술정보통신부는 디지털 분야 해외진출 및 수출 활성화 전략을 발표했다. 과기부는 SW·ICT 서비스 주요 품목이 해외 진출을 위한 특화 지원을 추진하고, 디지털 수출 영토 확대를 위해 중동, 동남아, 중남미 지역 등 신흥시장을 개척할 계획이다.정부는 오픈AI의 챗GPT와 구글 바드 출시로 AI 산업이 글로벌 화두로 떠오르면서 AI 수출을 꺼내들었다. 국산 AI가 해외에서도 활용될 수 있도록 글로벌 바우처를 신설하고 글로벌 AI 서비스 기획도 지원한다고 밝혔다.정부의 이런 정책 기조에 가장 주목받은 기업은 네이버다. 네이버는 미국 오픈AI GPT-3와 중국 화웨이 판구의 뒤를 이어 세계 3번째로 초거대 언어모델인 하이퍼클로바를 개발했다. 특히 오는 8월 24일에는 차세대 초거대 AI 모델인 ‘하이퍼클로바X'를 공개하고, 연내 여기에 기반을 둔 다양한 생성형 AI 서비스 공개도 앞두고 있다. 질의응답이나 검색을 넘어 콘텐츠 생산과 창작에서 다양하게 활용될 전망이다.하이퍼클로바X 기반 서비스 라인업.네이버가 ‘소버린 AI’를 내세워 해외 진출을 준비하고 있는 점도 디지털 기술 수출에 있어 강점으로 작용한다. 소버린 AI는 글로벌 빅테크 기업이 본격적으로 진출하지 않은 비영어권 국가들의 자체 언어 AI 모델 구축을 지원하는 전략이다. 중동과 아세안 지역 등을 중심으로 디지털 기술 수출을 이끌 수 있을 것으로 전망된다.이와 관련 하정우 네이버클라우드 AI 이노베이션 센터장은 최근 '초거대 AI 시대의 대한민국 그리고 AI 주권' 토론회에 참석해 일본어 초거대 AI 모델을 개발 중이며, 중동 시장과 동남아 시장에도 진출할 것을 밝혔다.이미 네이버는 지난 3월 사우디아라비아 자치행정주택부 및 투자부와 업무협약(MOU)을 체결해 디지털 전환에 다각적으로 협력하기로 하면서 중동 진출을 본격화해 네이버가 사우디의 네옴시티 프로젝트에 참여할 수 있다는 기대감도 높아지고 있다. 네이버는 LX한국구토정보공사와 이달 들어 디지털트윈 기술의 해외 진출을 위한 업무 협약도 맺었다.한편, 전 세계적으로 디지털 전환이 빠르게 진행되며 관련 수요도 확대되고 있다. 생성형 AI는 전 세계 시장 규모가 지난해 약 100억 달러에서 연평균 34.7%씩 성장해 2030년에는 1040억 달러 규모로 성장할 것으로 예상된다. 디지털 트윈 시장의 경우에는 2032년까지 900억 달러, 클라우드 시장은 2027년에 약 1조 4600억 달러 규모로 성장할 것으로 전망된다.",IT/과학
